500,Principles of Modern Economics,ECON 1000,Alexander Knight
501,The Quantum Universe: An Introduction,SCIE 1000,Dr. Lara Zheng
502,Advanced Algorithms and Data Structures,EECS 2011,Michael Torvalds
503,The History of Western Art,ARTS 2050,Elizabeth Rousseau
504,Mechanics of Materials,MECH 1020,Dr. Henry Jamal
505,Global Politics: A New Approach,POLI 3000,Prof. Carlos Mendoza
506,Environmental Science: Earth as a Living Planet,SCIE 2450,Dr. Naomi Watts
507,Cultural Anthropology in a Globalizing World,ANTH 2000,Sandra Dee
508,Introduction to Clinical Psychology,PSYC 1300,Patricia Johnson
509,Organic Chemistry: Structure and Function,SCIE 2000,Viktor Kovalenko
510,Fundamentals of Corporate Finance,FINC 2030,Sarah Lin
511,The Dynamics of Mass Communication,COMM 2000,Leo Franklin
512,Modern Database Management,EECS 3400,Priya Singh
513,Principles of Biochemistry,BIOC 2300,Dr. Harriet Oswald
514,Strategic Management and Competitive Advantage,MGMT 5000,Gilbert Strang
515,Introduction to Particle Physics,PHYS 2000,Dr. Klaus Schmidt
516,Philosophies of Education: A Contemporary Analysis,PHIL 3000,Maya Chen
517,Sociology: Understanding and Changing the Social World,SOCS 1000,Prof. Samuel Jackson
518,Comparative Literature: Across Cultures and Genres,LITR 3500,Anita Desai
519,Digital Marketing: Strategies and Insights,MARK 2100,Omar Farooq
